{
  "id": "sofa_parametric_straight_3seat",
  "type": "sofa",
  "tier": "C_parametric",
  "source": "parametric:tools.sofa_builder",
  "license_mode": "own",
  "variant": "straight",
  "style_tags": [
    "modern",
    "neutral",
    "dark_gray"
  ],
  "dimensions_m": {
    "width": 2.2,
    "depth": 0.95,
    "height": 0.85
  },
  "canonical_orientation": {
    "front_axis": "-Y",
    "back_axis": "+Y",
    "up_axis": "+Z"
  },
  "anchors": {
    "floor_origin": [
      0,
      0,
      0
    ],
    "back_center": [
      1.1,
      0.95,
      0
    ],
    "front_center": [
      1.1,
      0.0,
      0
    ]
  },
  "clearance_m": {
    "front": 0.75,
    "sides": 0.2,
    "back": 0.05
  },
  "required_parts": [
    "base",
    "seat_cushion",
    "back_cushion",
    "arm",
    "foot"
  ],
  "parts_present": [
    "arm",
    "back_cushion",
    "base",
    "foot",
    "seat_cushion"
  ],
  "quality": {
    "scale_checked": true,
    "orientation_checked": true,
    "materials_checked": true,
    "not_single_block": true,
    "thumbnail_checked": true,
    "gate": "PASS"
  },
  "thumbnail": "assets/furniture/sofa/thumbnails/sofa_parametric_straight_3seat_iso.png",
  "skp": null,
  "builder": {
    "module": "tools.sofa_builder",
    "fn": "build_sofa",
    "spec": "sofa_spec('straight',3)"
  }
}